id,name,description,category,muscles,muscles_secondary,equipment,images,difficulty,style
193,Diagonal Shoulder Press,"<p>You sit at the bench press device, back slightly tilted to the back. The bar should be about 20 cm in front of you. Then you push the bar and take it back again, as you would with a bench press.</p>
<p>In this position you strain your chest muscles a lot less, which is nice if you want to train, but your chest hasn't recovered yet.</p>
<p>Here's a link to a girl on a machine specialized for this exercise, to give a better description than my failing words above.</p>
<p>http://www.schnell-online.de/db_imgs/products/img/t-80400.jpg</p>",Shoulders,[],[],[8],[],beginner,['mixed']
203,Dumbbell Goblet Squat,"<p>Grasp dumbbell with both hands at the sides of the upper plates. Hold dumbbell in front of chest, close to torso. Place feet about shoulderwide apart, keep knees slightly bent.</p>
<p>Squat down until thighs are parallel to floor. Keep back straight, bend and move hips backward to keep knees above feet. Return, keep knees slightly flexed. Repeat.</p>
<p>Keep bodyweight on heels and look ahead or slightly above to keep back straight.</p>",Legs,[10],[],[3],"['https://wger.de/media/exercise-images/203/1c052351-2af0-4227-aeb0-244008e4b0a8.jpeg', 'https://wger.de/media/exercise-images/203/2ab30113-4e08-4d39-9d23-d901ce2c0971.jpeg', 'https://wger.de/media/exercise-images/203/300a44ac-4368-48e2-8b18-beea32ab915d.gif']",beginner,['mixed']
185,Decline Bench Press Barbell,"<p>Lay down on a decline bench, the bar should be directly above your eyes, the knees are somewhat angled and the feet are firmly on the floor. Concentrate, breath deeply and grab the bar more than shoulder wide. Bring it slowly down till it briefly touches your chest at the height of your nipples. Push the bar up.</p>",Chest,[4],[],[1],"['https://wger.de/media/exercise-images/100/Decline-bench-press-1.png', 'https://wger.de/media/exercise-images/100/Decline-bench-press-2.png']",beginner,['mixed']
186,Decline Bench Press Dumbbell,"<p>Take two dumbbells and sit on a decline bench, the feet are firmly on the floor, the head is resting the bench. Hold the weights next to the chest, at the height of your nipples and press them up till the arms are stretched. Let the weight slowly and controlled down.</p>",Chest,[4],[],[3],[],beginner,['mixed']
205,Dumbbell Lunges Standing,<p>.</p>,Legs,[10],[8],[3],[],beginner,['mixed']
914,Reverse EZ Bar Cable Curls,Standing in front of cable tower using a SZ Bar,Arms,[1],[],[2],[],beginner,['mixed']
926,Machine chest fly,"seated machine, straight back, slow exercise",Chest,[4],[],[],[],beginner,['mixed']
188,Decline Pushups,"<p>With your feet raised approximately 30cm on a platform, align your shoulders, elbows and hands, then perform regular pushups. This emphasises the clavicular fibers of the pectoralis major.</p>",Chest,[4],[2],[7],[],beginner,['mixed']
237,Fly With Cable,,Chest,[4],[],[],"['https://wger.de/media/exercise-images/122/Incline-cable-flyes-1.png', 'https://wger.de/media/exercise-images/122/Incline-cable-flyes-2.png']",beginner,['mixed']
206,Dumbbell Lunges Walking,"<p>Take two dumbbells in your hands, stand straight, feet about shoulder wide. Take one long step so that the front knee is approximately forming a right angle. The back leg is streched, the knee is low but doesn't touch the ground. ""Complete"" the step by standing up and repeat the movement with the other leg.</p>",Legs,[10],[8],[3],"['https://wger.de/media/exercise-images/113/Walking-lunges-1.png', 'https://wger.de/media/exercise-images/113/Walking-lunges-2.png', 'https://wger.de/media/exercise-images/113/Walking-lunges-3.png', 'https://wger.de/media/exercise-images/113/Walking-lunges-4.png']",beginner,['mixed']
239,"Fly With Dumbbells, Decline Bench","<p>The exercise is the same as with a regular bench:</p>
<p>Take two dumbbells and lay on a bench, make sure the feet are firmly on the ground and your back is not arched, but has good contact with the bench. The arms are stretched in front of you, about shoulder wide. Bend now the arms a bit and let them down with a half-circle movement to the side. Without changing the angle of the elbow bring them in a fluid movement back up.</p>",Chest,[4],[],[3],[],beginner,['mixed']
238,Fly With Dumbbells,"<p>Take two dumbbells and lay on a bench, make sure the feet are firmly on the ground and your back is not arched, but has good contact with the bench. The arms are stretched in front of you, about shoulder wide. Bend now the arms a bit and let them down with a half-circle movement to the side. Without changing the angle of the elbow bring them in a fluid movement back up.</p>",Chest,[4],[],[3],"['https://wger.de/media/exercise-images/238/2fc242d3-5bdd-4f97-99bd-678adb8c96fc.png', 'https://wger.de/media/exercise-images/238/c6464fb3-1924-4ff1-adfa-fd36da9b5d13.png']",beginner,['mixed']
204,Dumbbell Incline Curl,"<p>With elbows back to sides, raise one dumbbell and rotate forearm until forearm is vertical and palm faces shoulder. Lower to original position and repeat with opposite arm. Continue to alternate between sides.</p>",Arms,[1],[13],[3],[],beginner,['mixed']
211,Dumbbell Triceps Extension,"<p>Position one dumbbell over head with both hands under inner plate (heart shaped grip).</p>
<p>With elbows over head, lower forearm behind upper arm by flexing elbows. Flex wrists at bottom to avoid hitting dumbbell on back of neck. Raise dumbbell over head by extending elbows while hyperextending wrists. Return and repeat.</p>",Arms,[5],"[2, 4]",[3],[],beginner,['mixed']
194,Dips,"A dip is an upper-body strength exercise. Narrow, shoulder-width dips primarily train the triceps, with major synergists being the anterior deltoid, the pectoralis muscles (sternal, clavicular, and minor), and the rhomboid muscles of the back (in that order).[1] Wide arm training places additional emphasis on the pectoral muscles, similar in respect to the way a wide grip bench press would focus more on the pectorals and less on the triceps.",Chest,"[4, 5]",[5],[7],['https://wger.de/media/exercise-images/194/34600351-8b0b-4cb0-8daa-583537be15b0.png'],beginner,['mixed']
197,Dips Between Two Benches,"<p>Put two benches so far appart, that you can hold onto one with your hands and are just able to reach the other with your feet. The legs stay during the exercise completely stretched. With your elbows facing back, bend them as much as you can. Push yourself up, but don't stretch out the arms.</p>",Arms,[5],[],[8],"['https://wger.de/media/exercise-images/83/Bench-dips-1.png', 'https://wger.de/media/exercise-images/83/Bench-dips-2.png']",beginner,['mixed']
208,Dumbbells on Scott Machine,,Arms,[1],[],[],[],beginner,['mixed']
254,Front Raises with Plates,,Shoulders,"[2, 9]",[],[],[],beginner,['mixed']
283,Hanging Leg Raises,"<p>Hanging from bar or straps, bring legs up with knees extended or flexed</p>",Abs,[6],[],[6],[],beginner,['mixed']
256,Front Raises,"<p>To execute the exercise, the lifter stands with their feet shoulder width apart and weights or resistance handles held by their side with a pronated (overhand) grip.</p>
<p>The movement is to bring the arms up in front of the body to eye level and with only a slight bend in the elbow. This isolates the anterior deltoid muscle (front of the shoulder) and uses the anterior deltoid to lift the weight.</p>
<p>When lifting it is important to keep the body still so the anterior deltoid is fully utilised; if the weight cannot be lifted by standing still then it is too heavy and a lower weight is needed. It is important to keep a slight bend in the elbow when lifting as keeping the elbow locked will add stress to the elbow joint and could cause injury.</p>
<p>A neutral grip, similar to that used in the hammer curl, can also be used. With this variation the weight is again raised to eye level, but out to a 45 degree angle from the front of the body. This may be beneficial for those with shoulder injuries, particularly those related to the rotator cuff.</p>",Shoulders,[2],[],"[1, 3]",['https://wger.de/media/exercise-images/256/b7def5bc-2352-499b-b9e5-fff741003831.png'],beginner,['mixed']
301,Hyperextensions,"<p>Lie on the hyperextension pillow with your navel at the front edge, allowing your upper body to hang freely. Tighten all your back muscles and raise your torso until you're horizontal, but no higher. Lower yourself slowly, maintaining a steady flow of muscles.</p>",Back,[9],[],[],"['https://wger.de/media/exercise-images/128/Hyperextensions-1.png', 'https://wger.de/media/exercise-images/128/Hyperextensions-2.png']",beginner,['mixed']
291,Hindu Squats,"<p>Start with your feet shoulder width apart and arms slightly behind your back.</p>
<p>As you descend towards the floor, raise your heels off the ground, while keeping your back as vertical  as possible. </p>
<p>Upon attaining the bottom position, touch the hands to the heels.</p>
<p>Then stand up ending with the heels on the ground, arms extended in front of the chest then rowing into the start position.</p>",Legs,[10],[8],[],[],beginner,['mixed']
257,Front Squats,<p>This variation of the squat trains the hamstrings and gluteus maximus. It also works the back extensors and abductors.</p>,Legs,[8],[6],[1],"['https://wger.de/media/exercise-images/191/Front-squat-1-857x1024.png', 'https://wger.de/media/exercise-images/191/Front-squat-2-857x1024.png']",beginner,['mixed']
285,High Knee Jumps,"<p>-Start with legs slightly wider than shoulder width</p>
<p>-Drop into a bodyweight squat</p>
<p>-As you hit the bottom of the squat, explode upwards into a jump while simultaneously tucking your knees into your chest midflight.  Remain tucked until the apex of your jump.</p>
<p>-Land on both feet, making sure your knees are not locked so as to avoid excessive strain upon your joints.  Collect yourself into the next rep as quickly but under control as possible.</p>",Cardio,"[11, 7, 10, 15]","[14, 6, 3]",[],[],beginner,['mixed']
275,Hammercurls on Cable,"<p>Take a cable in your hands (palms parallel, point to each other), the body is straight. Bend the arms and bring the weight up with a fast movement. Without any pause bring it back down with a slow, controlled movement, but don't stretch completely your arms.</p>
<p>Don't swing your body during the exercise, the biceps should do all the work here. The elbows are at your side and don't move.</p>",Arms,[1],[13],[],"['https://wger.de/media/exercise-images/138/Hammer-curls-with-rope-1.png', 'https://wger.de/media/exercise-images/138/Hammer-curls-with-rope-2.png']",beginner,['mixed']
901,Barbell Hip Thrust,"Sit on the ground with a bench behind you, bending your knees so your feet are planted on the ground and holding a barbell resting below your hips. If you have a padded bar, or anything you can slip in between the bar and your body, it will go a long way to making the exercise more comfortable.",Legs,[8],[],[1],[],beginner,['mixed']
915,BUS DRIVERS,"Sitting with a Weight Plate, used as wheel, in both hands; raised slightly below eye level",Shoulders,[2],[],[],[],beginner,['mixed']
272,Hammercurls,"<p>Hold two dumbbells and sit on a bench with a straight back, the shoulders are slightly rolled backwards. Your pals point to your body. Bend the arms and bring the weight up with a fast movement. Don't rotate your hands, as with the curls. Without any pause bring the dumbbell down with a slow, controlled movement.</p>
<p>Don't swing your body during the exercise, the biceps should do all the work here. The elbows are at your side and don't move.</p>",Arms,[1],[],[3],"['https://wger.de/media/exercise-images/86/Bicep-hammer-curl-1.png', 'https://wger.de/media/exercise-images/86/Bicep-hammer-curl-2.png']",beginner,['mixed']
279,Hand Grip,<p>chrome Hand Flex Grip to build up forearms muscles</p>,Arms,[],[],[],['https://wger.de/media/exercise-images/279/36605bc8-d7e1-43e1-87c1-b9cb50db62b2.webp'],beginner,['mixed']
245,Skullcrusher Dumbbells,"<p>Hold the dumbbells and lay down on a flat bench in such a way that around 1/4 of your head is over the edge. Stretch arms straight up and then lean dumbbells away from your toes to a 10-20 degree angle. Keep upper arm at this angle throughout exercise. Dumbbell shall not be amed at your head, but away over your head. This will maximise gain from exercise with load on triceps all the time.</p>
<p>Pay attention to your elbows and arms: only the triceps are doing the work, the rest of the arms should not move.</p>",Arms,[5],[],"[8, 3]",[],beginner,['mixed']
246,Skullcrusher SZ-bar,"<p>Hold the SZ-bar and lay down on a flat bench in such a way that around 1/4 of your head is over the edge. Stretch your arms with the bar and bend them so that the bar is lowered. Just before it touches your forehead, push it up.</p>
<p>Pay attention to your elbows and arms: only the triceps are doing the work, the rest of the arms should not move.</p>",Arms,[5],[],"[8, 2]","['https://wger.de/media/exercise-images/84/Lying-close-grip-triceps-press-to-chin-1.png', 'https://wger.de/media/exercise-images/84/Lying-close-grip-triceps-press-to-chin-2.png']",beginner,['mixed']
292,"Hip Raise, Lying","Lying down on your back, with your feet flat on the floor. Raise your hips up evenly as high as you can and hold for as long as you can.",Back,[],[],[7],[],beginner,['mixed']
259,Front Pull narrow,,Back,[12],"[1, 13]","[1, 2]",[],beginner,['mixed']
258,Front pull wide,,Back,[12],"[2, 1, 13]","[1, 2]",[],beginner,['mixed']
284,Hercules Pillars,<p>Grab two cables stand in the middle so both have tension and hold</p>,Arms,"[1, 13, 5]",[2],[],[],beginner,['mixed']
282,Handstand Pushup,"The handstand push-up (press-up) - also called the vertical push-up (press-up) or the inverted push-up (press-up) also called commandos- is a type of push-up exercise where the body is positioned in a handstand. For a true handstand, the exercise is performed free-standing, held in the air. To prepare the strength until one has built adequate balance, the feet are often placed against a wall, held by a partner, or secured in some other way from falling. Handstand pushups require significant strength, as well as balance and control if performed free-standing.",Shoulders,"[9, 5]",[],[7],[],beginner,['mixed']
294,Hip Thrust,"<p>The bar should go directly on your upper thigh, directly below your crotch. Your feet should be directly under your knees. Push your hips up so that you form a straight line from your knees to your shoulders. Use a pad for comfort.</p>",Legs,[8],[],"[1, 8]",[],beginner,['mixed']
289,High Pull,"<p>Use a light barbell, perform explosive lift up starting from underneath knee cap level. Lift/raise explosively using hips, at shoulder level. Tempo: 2111</p>",Shoulders,[2],[8],[],[],beginner,['mixed']
297,Hollow Hold,"<p>Get on a mat and lie on your back. Contract your abs, stretch your raise and legs and raise them (your head and shoulders are also be raised). Make sure your lower back remains in contact with the mat.</p>",Abs,"[14, 6]",[],"[4, 7]",[],beginner,['mixed']
1634,Rope Pullover/row,Set up bench in front of cable row machine. Lean over bench to do a row/pullover with rope that targets lats. See picture.,Back,[12],[],[9],['https://wger.de/media/exercise-images/1634/9a4704d3-1b25-43e3-b244-3885f4d3db87.png'],beginner,['mixed']
1637,Single arm row,"Sitting on the ground, use a high cable in a single grip, to do lat pulldowns with a focus on a long stretch in the lats.",Back,[12],[],[9],['https://wger.de/media/exercise-images/1637/a1fbe83a-a3e5-49f6-a2c2-5d5b533c2be8.png'],beginner,['mixed']
1638,Barbell Clean and press,"This exercise involves lifting a barbell from the ground to the shoulders, then pressing it overhead. It is a compound movement that targets multiple muscle groups, including the legs, back, shoulders, and arms. It is often used in strength and conditioning programs to improve overall power and athleticism.",Shoulders,"[2, 4]",[],[3],['https://wger.de/media/exercise-images/1638/046c09b0-c35d-48d0-a552-39dd49f956d2.webp'],beginner,['mixed']
268,Good Mornings,,Legs,[11],[],[],"['https://wger.de/media/exercise-images/116/Good-mornings-2.png', 'https://wger.de/media/exercise-images/116/Good-mornings-1.png']",beginner,['mixed']
310,Incline Dumbbell Row,"<ol>
<li>Using a neutral grip, lean into an incline bench.</li>
<li>Take a dumbbell in each hand with a neutral grip, beginning with the arms straight. This will be your starting position.</li>
<li>Retract the shoulder blades and flex the elbows to row the dumbbells to your side.</li>
<li>Pause at the top of the motion, and then return to the starting position.</li>
</ol>",Back,[],[12],"[3, 9]",[],beginner,['mixed']
827,Front Plate Raise,"The plate front raise is a variation of the dumbbell front raise where the lifter holds a weight plate between two hands, rather than using a dumbbell, barbell, or other weight. It can provide variety in a shoulder-focused muscle-building workout, or as part of an upper body or full-body circuit.
<ol><li>While standing straight, hold a barbell plate in both hands at the 3 and 9 o'clock positions. Your palms should be facing each other and your arms should be extended and locked with a slight bend at the elbows and the plate should be down near your waist in front of you as far as you can go. <b>Tip</b>: The arms will remain in this position throughout the exercise. This will be your starting position.</li><li>Slowly raise the plate as you exhale until it is a little above shoulder level. Hold the contraction for a second. As you inhale, slowly lower the plate back down to the starting position.</li><li>Repeat for the recommended amount of repetitions.</li></ol>",Shoulders,[2],[],[],[],beginner,['mixed']
365,Leg Curls (laying),"<p>Lay on a bench and put your calves behind the leg holder (better if they are hold on around the lower calves). Hold a grip on the bars to make sure the body is firmly in place. Bend your legs bringing the weight up, go slowly back. During the exercise the body should not move, all work is done by the legs.</p>",Legs,[11],[],[],"['https://wger.de/media/exercise-images/154/lying-leg-curl-machine-large-1.png', 'https://wger.de/media/exercise-images/154/lying-leg-curl-machine-large-2.png']",beginner,['mixed']
354,Lat Pull Down (Leaning Back),"<p>Lean Back, Pull into chest</p>",Back,[12],[],[],[],beginner,['mixed']
355,Lat Pull Down (Straight Back),<p>Pull bar down to strenum and keep straight back.</p>,Back,[12],[],[],[],beginner,['mixed']
366,Leg Curls (sitting),,Legs,[11],[],[],"['https://wger.de/media/exercise-images/117/seated-leg-curl-large-1.png', 'https://wger.de/media/exercise-images/117/seated-leg-curl-large-2.png']",beginner,['mixed']
349,"Lateral Rows on Cable, One Armed","<p>Set cable at waist height, start with arm across your belly and move han over and out too other side, one arm at the time.</p>",Shoulders,[2],[],[],"['https://wger.de/media/exercise-images/349/9d969203-9cb6-4d47-9c31-fef53bfe1de5.png', 'https://wger.de/media/exercise-images/349/8dc5ad63-a93a-496f-9473-ac414236e58d.png', 'https://wger.de/media/exercise-images/349/7359ab6a-72a4-4ed8-b7da-35d57aaa2199.png', 'https://wger.de/media/exercise-images/349/d74d171e-d39a-4c13-bbcd-6821bc94d424.png']",beginner,['mixed']
348,Lateral Raises,"This exercise works the deltoid muscle of the shoulder. The movement starts with the arms straight, and the hands holding weights at the sides or in front of the body. Body is in a slight forward-leaning position with hips and knees bent a little. Arms are kept straight or slightly bent, and raised through an arc of movement in the coronal plane that terminates when the hands are at approximately shoulder height. Weights are lowered to the starting position, completing one rep. When using a cable machine the individual stands with the coronal plane in line with the pulley, which is at or near the ground.[9] The exercise can be completed one shoulder at a time (with the other hand used to stabilize the body against the weight moved), or with both hands simultaneously if two parallel pulleys are available.",Shoulders,[2],[],[3],"['https://wger.de/media/exercise-images/148/lateral-dumbbell-raises-large-2.png', 'https://wger.de/media/exercise-images/148/lateral-dumbbell-raises-large-1.png']",beginner,['mixed']
902,Barbell Hip Thrust,"Sit on the ground with a bench behind you, bending your knees so your feet are planted on the ground and holding a barbell resting below your hips. If you have a padded bar, or anything you can slip in between the bar and your body, it will go a long way to making the exercise more comfortable.",Legs,[8],[],[1],[],beginner,['mixed']
916,Smith Press,"Sitting almost 90 degree angle, smith machine&nbsp;",Shoulders,[2],[],[9],[],beginner,['mixed']
314,Isometric Wipers,"<p>Assume push-up position, with hands slightly wider than shoulder width.</p>
<p>Shift body weight as far as possible to one side, allowing the elbow on that side to flex. </p>
<p>Reverse the motion, moving completely over to the other side.</p>
<p>Return to the starting position, and repeat for the desired number of repetitions.</p>",Chest,[4],[6],[7],[],beginner,['mixed']
364,Leg Curl,"The leg curl, also known as the hamstring curl, is an isolation exercise that targets the hamstring muscles. The exercise involves flexing the lower leg against resistance towards the buttocks. Other exercises that can be used to strengthen the hamstrings are the glute-ham raise and the deadlift.",Legs,"[11, 8]",[],[],['https://wger.de/media/exercise-images/364/b318dde9-f5f2-489f-940a-cd864affb9e3.png'],beginner,['mixed']
351,Lateral-to-Front Raises,"<p>-(1) Perform a lateral raise, pausing at the top of the lift (2).</p>
<p>-Instead of lowering the weight, bring it to the front of your body so that you appear to be at the top position of a front raise.  You will do this by using a Pec Fly motion, maintaining straight arms. (3)</p>
<p>-Now lower the weight to your quadriceps, or, in other words, lower the dumbbells as though you are completing a Front Raise repetition. (4)</p>
<p>-Reverse the motion:  Perform a front raise (5), at the apex of the lift use a Reverse Fly motion to position the weights at the top of a Lateral Raise (6), and finally, lower the weights until your palms are essentially touching the sides of your thighs (7).  THIS IS ONE REP.</p>
<p>(1) l  <em>front view  </em>(2) -l- <em> FV  </em>  (3) l-  <em>side view</em>   (4) l  <em>SV/FV</em>   (5) l-  <em>SV  </em> (6) -l-  <em>FV  </em>  (7)  l  <em>FV/SV</em></p>",Shoulders,"[2, 9]",[],[3],[],beginner,['mixed']
313,Incline Push up,<p>Regular push with a 30 degree incline.</p>,Chest,[4],[11],[],[],beginner,['mixed']
341,Squats on Multipress,,Legs,[10],[8],[],[],beginner,['mixed']
308,Incline Dumbbell Fly,"<p>Use inclined bench. Hold dumbbells straight out to your sides, elbows slightly bent. Bring arms together above you, keeping angle of elbows fixed.</p>",Chest,[4],[],"[3, 9]",[],beginner,['mixed']
320,Jumping Jacks,"<p>A jumping jack or star jump, also called side-straddle hop in the US military, is a physical jumping exercise performed by jumping to a position with the legs spread wide and the hands going overhead, sometimes in a clap, and then returning to a position with the feet together and the arms at the sides</p>",Legs,[10],[],[],[],beginner,['mixed']
312,Incline Plank With Alternate Floor Touch,"<p>Perform the plank with legs elevated, feet on a gymball. Once stabilised, slowly move one foot sideways off the ball, then make it touch the floor, then come back to starting position. Alternate with the other foot.</p>
<p>This is a core exercise.</p>",Abs,[6],[14],[],[],beginner,['mixed']
331,Kettlebell Swings,"<p>Hold the kettlebell securely in both hands. Keep your back flat throughout the move, avoiding any rounding of the spine.Keeping your knees ""soft"", hinge your hips backwards, letting the kettlebell swing between your knees.</p>
<p>You want to bend from the hips as far as you can <em>without letting your back round forwards</em>. Then, snap your hips forwards quickly and standing up straight, locking your body in an upright posture.</p>
<p>The speed you do this will cause your arms and the kettlebell to swing up in front of you. Don't try to <em>lift</em> the kettlebell with your arms. The snapping forwards of your hips will cause the kettlebell to swing forwards through momentum. Depending on the weight of the kettlebell and the speed of your hip movement, your arms will swing up to about shoulder height. At the top of this swing, let your hips hinge backwards again as the kettlebell swings back down to between your legs and the start of the next repetition.</p>",Legs,[8],[11],[10],[],beginner,['mixed']
346,Landmine press,,Shoulders,[2],"[4, 5]",[1],[],beginner,['mixed']
323,Cable Cross-over,"<p>Begin with cables at about shoulder height, one in each hand. Take a step forward so that one foot is in front of the other, for stability, and so that there is tension on the cables. Bring hands together in front of you. Try to make your hands overlap (so that the cables cross) a few inches.</p>",Chest,[4],[2],[],"['https://wger.de/media/exercise-images/71/Cable-crossover-2.png', 'https://wger.de/media/exercise-images/71/Cable-crossover-1.png']",beginner,['mixed']
319,Jogging,"<p>Get your shoes on, go outside and start running at a moderate pace.</p>",Cardio,[],[],[],[],beginner,['mixed']
380,Leverage Machine Iso Row,<p>Adjust seat height so that the handles are at the bottom of your pectorals or just below.</p>,Back,[12],[],[],[],beginner,['mixed']
