id,name,description,category,muscles,muscles_secondary,equipment,images,difficulty,style
395,"Long-Pulley, Narrow","<p>The exercise is the same as the regular long pulley, but with a narrow grip:</p>
<p>Sit down, put your feet on the supporting points and grab the bar with a wide grip. Pull the weight with a rapid movement towards your belly button, not upper. Keep your arms and elbows during the movement close to your body. Your shoulders are pulled together. Let the weight slowly down till your arms are completely stretched.</p>",Back,[12],"[1, 13]",[],[],beginner,['mixed']
427,Negative Crunches,"<p>Sit yourself on the decline bench and fix your legs. Cross your arms over the chest and bring with a rolling movement your upper body up, go now without a pause and with a slow movement down again. Don't let your head move during the exercise.</p>",Abs,[6],[],[],"['https://wger.de/media/exercise-images/93/Decline-crunch-1.png', 'https://wger.de/media/exercise-images/93/Decline-crunch-2.png']",beginner,['mixed']
418,Military Press mit SZ-Bar,"<p>On an SZ-bar grip your hands on the outside of each bend and stand with your arms straight down, palms facing your legs. Pull the bar (bending your arms at the elbow) to your chest, and the push the bar above your head (arms as straight as possible). Return the bar to your chest by dropping your arms at the elbows. Return the bar to it's origional position (stand with your arms straight down, palms facing your legs.)</p>",Shoulders,[],[],[2],['https://wger.de/media/exercise-images/418/fa2a2207-43cb-4dc0-bc2a-039e32544790.png'],beginner,['mixed']
386,Diamond push ups,,Chest,[4],[5],[7],[],beginner,['mixed']
378,"Leg Raises, Standing","<p>Put your forearms on the pads on the leg raise machine, the body is hanging freely. Lift now your legs with a fast movement as high as you can, make a short pause of 1sec at the top, and bring them down again. Make sure that during the exercise your body does not swing, only the legs should move.</p>",Abs,[6],[3],[],[],beginner,['mixed']
917,Straight Bar Cable Front Raise,"Back to cable tower, cable between legs, SZ Bar",Shoulders,[2],[],[2],[],beginner,['mixed']
379,Leverage Machine Chest Press,<p>Be sure to adjust seat height so that the handles are towards the bottom of your pectorals.</p>,Chest,[4],[],[],[],beginner,['mixed']
957,Quadriped Arm and Leg Raise,"In this exercise, the back muscles and the muscles of the back of the leg and back of the arm are activated by lifting the crossed arm and leg at the same time in the crawling position. It also improves balance and proprioception. The movement is done symmetrically.

1. Get into a crawling posture.2. Draw your abdomen in, then raise your right leg and left arm.3. You should keep your abdomen in for 8 seconds.4. After 8 seconds, slowly lower your arm and leg.5. Then release your muscle.
",Back,"[2, 8, 3, 9]",[12],[7],['https://wger.de/media/exercise-images/957/0fd94587-6021-4763-856e-7227f5fcba2a.png'],beginner,['mixed']
377,"Leg Raises, Lying",<p>Lay down on a bench and hold onto the recliner with your hands to keep you stable. Hold your legs straight and lift them till they make an angle of about 45°. Make a short pause of 1 sec. and go slowly down to the initial position. To increase the intensity you can make a longer pause of 7 sec. every 5th time.</p>,Abs,[6],[3],[4],"['https://wger.de/media/exercise-images/125/Leg-raises-2.png', 'https://wger.de/media/exercise-images/125/Leg-raises-1.png']",beginner,['mixed']
376,Leg Raise,"The leg raise is a strength training exercise which targets the iliopsoas (the anterior hip flexors). Because the abdominal muscles are used isometrically to stabilize the body during the motion, leg raises are also often used to strengthen the rectus abdominis muscle and the internal and external oblique muscles.",Legs,"[14, 6]",[],[],[],beginner,['mixed']
394,Long-Pulley (low Row),"Sit down, put your feet on the supporting points and grab the bar with a wide grip. Pull the weight with a rapid movement towards your belly button, not upper. Keep your arms and elbows during the movement close to your body. Your shoulders are pulled together. Let the weight slowly down till your arms are completely stretched.",Back,[12],"[1, 13]",[],"['https://wger.de/media/exercise-images/143/Cable-seated-rows-2.png', 'https://wger.de/media/exercise-images/143/Cable-seated-rows-1.png']",beginner,['mixed']
397,Low Box Squat - Wide Stance,"<p>Unrack the bar and set your stance wide, beyond your hips.  Push your hips back and sit down to a box that takes you below parallel.  Sit completely down, do not touch and go.  Then explosively stand up.  Stay tight in your upper back and torso throughout the movement.</p>",Legs,"[8, 10]",[],[1],[],beginner,['mixed']
